Title,Summary,Genre,Feature
사브리나의 오싹한 모험,"평범한 10대 소녀와 마법을 부리는 마녀. 둘 중 어느 쪽이 더 좋을까? 반은 인간이고 반은 마녀인 사브리나. 이제 그녀의 선택에 따라, 완전히 새로운 인생이 시작된다.",TV 프로그램 판타지 TV 프로그램 만화 원작 TV 프로그램 10대 TV 프로그램 호러 미국 TV 프로그램,등골 서늘 무서운 이야기 다크
타임리스,"시간 여행을 시작한 역사학자, 군인, 프로그래머. 이들의 목표는 단 하나. 시간의 연속성을 교란하려는 미지의 범죄자들을 잡는 것!",TV 프로그램 SF 미국 TV 프로그램 TV 프로그램 액션   어드벤처,흥미진진
DC 타이탄,복수에는 대가가 따른다. 정체를 숨기고 형사가 된 딕 그레이슨. 이제 그는 고담의 악몽에서 빠져나온 것인가. 의지할 곳 없는 젊은 히어로들이 딕 앞에 나타난다.,TV 프로그램 SF TV 프로그램 만화 원작 미국 TV 프로그램 TV 프로그램 액션   어드벤처,다크
리전,"환영과 환청에 시달리는 한 청년. 지난 기억을 조각조각 모으기 시작하면서 자신의 숨겨진 힘을 발견하게 되는데. 이전에 없던, 누구보다 특별한 능력을 가진 히어로가 온다!",TV 프로그램 SF TV 프로그램 만화 원작 미국 TV 프로그램,현실 붕괴
DC 레전드 오브 투모로우,미래에서 온 미스터리한 '타임 마스터'가 개성 뚜렷한 슈퍼히어로와 악당들을 한 팀으로 꾸려 불멸의 악당으로부터 지구 수호에 나선다.,TV 프로그램 SF TV 프로그램 만화 원작 미국 TV 프로그램 TV 프로그램 액션   어드벤처,흥미진진
더크 젠틀리의 전체론적 탐정 사무소,"세상 모든 것이 서로 연결됐다고 믿는 탐정 더크, 그에게 운명처럼 휘말린 조수 토드. 초자연, 미스터리, 시작과 끝을 알 수 없는 기이한 사건이라면 이들이 적격이다.",TV 프로그램 SF 도서 원작의 TV 프로그램 TV 프로그램 미스터리 TV 프로그램 코미디 미국 TV 프로그램 TV 프로그램 액션   어드벤처,현실 붕괴 엉뚱 기발 흥미진진
황혼에서 새벽까지: 시리즈,로버트 로드리게즈의 컬트 공포 영화를 토대로 한 오리지널 시리즈. 은행 강도 형제가 국경 남쪽에서 복수심에 불타는 경찰과 악마를 만난다.,TV 프로그램 판타지 TV 프로그램 호러 미국 TV 프로그램 TV 프로그램 액션   어드벤처,불길한 기운 무서운 이야기 긴장감 넘치는
기묘한 이야기의 궁금한 이야기,"출연진과 제작진이 들려주는 《기묘한 이야기 2》의 모든 것. 구상, 제작 비화부터 각 인물의 캐릭터 해석까지, 기묘한 세계의 늪으로 초대한다. ""스포일러 나갑니다!""",TV 프로그램 버라이어티   토크쇼 토크쇼 TV 프로그램 SF TV 프로그램 10대 미국 TV 프로그램 버라이어티 예능 리얼리티  버라이어티   토크쇼,불길한 기운
오행자객,"평범한 요리사로 살고 싶었으나, 세계를 구할 영웅으로 선택받은 남자. 마지막 오행자객인 그에게 특별한 임무가 주어진다. 신비로운 오행의 힘이 악용되는 것을 막아라!",TV 프로그램 판타지 미국 TV 프로그램 TV 프로그램 액션   어드벤처,흥미진진
파이널 스페이스,"외로운 우주인 죄수 게리 굿스피드. 어느 날, 귀여운 외계인 달빵이를 만나다. 그런데 이 녀석이 무시무시한 행성 파괴 병기라고? 어쩔 수 없지, 함께 우주를 구해보자!",TV 프로그램 SF TV 프로그램 코미디 미국 TV 프로그램 TV 프로그램 액션   어드벤처,푼수 캐릭터 흥미진진
나이트플라이어,"위기에 빠진 지구, 암울한 인류의 미래. 각 분야의 과학자들과 강력한 텔레파스 한 명이 비밀스러운 우주선에 승선한다. 각자의 희망을 품고서, 미지의 존재에 닿기 위해.",TV 프로그램 SF 도서 원작의 TV 프로그램 TV 프로그램 스릴러 TV 프로그램 호러 미국 TV 프로그램 사이버펑크 외계인 SF,무서운 이야기 다크 긴장감 넘치는
네오 요키오,네오 요키오의 냉소적인 상류사회를 주름잡는 캐즈. 좋아하는 건 연애와 패션이지만 해야 하는 건 초자연적 힘과의 대결. 산만한 주인 덕에 성실한 기계 집사만 죽어난다!,TV 프로그램 판타지 TV 프로그램 10대 TV 프로그램 코미디 미국 TV 프로그램,엉뚱 기발
그린리프,"멤피스에서 거대 교회를 운영하는 그린리프 일가. 막대한 부와 권력을 소유했지만 탐욕과 간음, 온갖 죄악으로 얼룩진 한 집안의 진실이 드러난다.",TV 드라마 미국 TV 프로그램,풍부한 감정
사우스 파크,"사우스 파크 마을에 사는 꼬맹이 4인방. 생김새는 평범하지만 입은 거칠고 생각은 험하다. 정치, 연예, 문화, 시사까지 성역 없이 던져지는 녀석들의 돌직구. 사우스 파크만의 사이다 멘트와 블랙 유머가 살아있는 어른용 애니메이션.",시트콤 TV 프로그램 코미디 미국 TV 프로그램,논쟁적 황당한 이야기 선정적 위트
언브레이커블 키미슈미트,종말론 사이비 종교에서 구출되어 뉴욕으로 온 키미 슈미트. 종말했다고 믿었던 세상에서 살아남기 위한 초긍정녀 키미의 고군분투가 펼쳐진다.,시트콤 TV 프로그램 코미디 미국 TV 프로그램,위트 엉뚱 기발 푼수 캐릭터
커뮤니티,학력 위조가 발각돼 변호사 자격을 박탈당한 제프. 다시 변호사가 되려고 커뮤니티 칼리지에 들어갔다가 불순(?)한 의도로 스터디 그룹을 결성한다. 좌충우돌 늦깎이 대학 생활을 그린 병맛 코미디. (시즌 2의 1개 에피소드 이용 불가),시트콤 TV 프로그램 코미디 미국 TV 프로그램,위트
스페이스 포스,"막 4성 장군이 됐다. 미군에 신설된 우주군의 대장이 됐다. 이제 하늘로 날아오르기만 하면 된다. 그런데 공군에게 무시당하고, 과학팀장과는 어긋나고. 진짜 폭발하겠네!",TV 프로그램 코미디 미국 TV 프로그램,엉뚱 기발 가슴 뭉클
슛! 반드시 빅리그,경기장에서 툭 하면 쫓겨나는 고등학교 농구팀 감독 벤. 성질은 불같아도 자신이 이끄는 팀은 끔찍이도 아낀다. 지금은 실력이 형편없어도 혹시 또 알아? 내일은 빛날지도.,시트콤 TV 프로그램 코미디 미국 TV 프로그램,선정적 위트 엉뚱 기발
국경없는 코난 투어,"미국을 대표하는 토크쇼 진행자, 코난 오브라이언. 그가 이번엔 세계 방방곡곡을 누빈다. 언어 배우랴 음식 맛보랴, 바쁘다 바빠! 여기에다 나라를 가리지 않는 유머 감각은 덤! 숨길 수 없는 개그 본능으로 빛나는 그의 지구촌 여행기.",TV 프로그램 버라이어티   토크쇼 다큐멘터리 여행   어드벤처 사회   문화 다큐멘터리 다큐멘터리 정치 토크쇼 TV 프로그램 정치 TV 프로그램 음식   여행 TV 프로그램 코미디 미국 TV 프로그램 다큐시리즈 버라이어티 예능 리얼리티  버라이어티   토크쇼,선정적 위트 엉뚱 기발
크레이지 엑스 걸프렌드,학창 시절 조쉬에게 차이고도 몇 년간 애만 태우던 레베카. 이제 사랑을 쟁취하고자 잘 나가던 뉴욕 변호사 생활을 청산하고 캘리포니아로 떠난다.,TV 프로그램 코미디 로맨스 TV 프로그램 코미디 미국 TV 프로그램 인기 로맨스 음악   뮤지컬,엉뚱 기발 로맨스
보잭 홀스맨,"90년대 최고의 시트콤 스타였던 보잭은 과연 20년 후 어떤 모습으로 살고 있을까? 괴팍한 동물이지만 마음만은 비단결인 보잭. 아니, 비단까지는 아니고 명주 정도 되려나?",시트콤 TV 프로그램 코미디 미국 TV 프로그램,냉소적 위트
원 데이 앳 어 타임,미국 시트콤의 고전을 리메이크했다. 고등학생 딸과 초등학생 아들을 친정 엄마의 도움 아닌 도움으로 키워가는 쿠바계 열혈 싱글맘. 그녀의 하루하루를 담았다.,시트콤 가족이 함께 보기 좋은 TV TV 프로그램 코미디 미국 TV 프로그램,기분 좋아지는 시간 푼수 캐릭터 풍부한 감정
윌 스미스의 프린스 오브 벨-에어,"오늘도 평화로운 캘리포니아의 대저택. 딩동~ 어느 날 불청객이 들이닥친다. 바로 필라델피아에서 온 친척 윌. 거침없고, 화끈한 열혈 청년이다. 딱 봐도 심상치 않은 만남인데. 이 집 사람들의 운명, 이제 발칵 뒤집힐 일만 남았다.",시트콤 가족이 함께 보기 좋은 TV TV 프로그램 코미디 미국 TV 프로그램,기분 좋아지는 시간 푼수 캐릭터 풍부한 감정
오싹한 만남,"속아서 웃기고, 가짜라서 다행이다. 끔찍한 공포와 놀라운 재미를 동시에 맛보는 몰래카메라 쇼. 출근 첫날 직장에서, 평범한 사람들이 공포 영화의 주인공이 된다.",리얼리티 TV TV 프로그램 코미디 TV 프로그램 호러 미국 TV 프로그램 버라이어티 예능 리얼리티  버라이어티   토크쇼,아드레날린 폭발 무서운 이야기 긴장감 넘치는 흥미진진
풀러 하우스,싱글맘인 DJ 태너-풀러의 세 아들 양육을 도우러 한 지붕 아래로 들어온 여동생 스테파니와 친구 키미. 이때부터 바람 잘 날 없는 태너 가족 이야기가 펼쳐진다.,시트콤 가족이 함께 보기 좋은 TV TV 프로그램 코미디 미국 TV 프로그램,가슴 뭉클
애쉬 vs 이블 데드,"30년 후, 잘린 손목에 전기톱을 단 악마 사냥꾼 애쉬가 돌아왔다! 봉인된 악령이 깨어나고, 다시 시작된 핏빛 대결. 장난스러운 그의 장난 아닌 세상 구하기가 시작된다.",TV 프로그램 코미디 TV 프로그램 호러 미국 TV 프로그램 TV 프로그램 액션   어드벤처,폭력 무서운 이야기
미드나잇 가스펠,"저기, 인터뷰 좀 해줄 수 있어요? 시뮬레이터로 가상 우주를 여행하는 우주 방송 진행자 클랜시. 삶과 죽음 사이에서 헤매고 있다면 구독하세요. 답을 찾을지도 모르니.",TV 프로그램 코미디 미국 TV 프로그램,현실 붕괴 색다른 이야기
아처,상냥하고 세련된 스파이 아처는 멋진 장치로 무장했지만 상사인 어머니와는 여전히 부딪친다.,시트콤 TV 프로그램 코미디 미국 TV 프로그램 TV 프로그램 액션   어드벤처,선정적 위트
그때 그 시절 패밀리,"아이들이 신나게 뛰놀고, 맥주를 자유롭게 마시며, 남자들이 아무 방해 없이 TV 시청을 즐기던 1970년대에 사는 머피 가족을 만나보자.",시트콤 TV 프로그램 코미디 미국 TV 프로그램,냉소적 선정적
70년대쇼,1970년대 교외에 사는 한 십대 소년과 친구들이 지하실 방에 모여 록 음악을 듣고?멋진 70년대 문화의 즐거움을 한껏?만끽한다.,시트콤 TV 프로그램 코미디 미국 TV 프로그램,푼수 캐릭터
빅 마우스,"오, 놀랍고 위대한 사춘기여! 10대들의 삶을 완전히 뒤흔드는구나! 닉 크롤과 앤드루 골드버그 콤비가 사이좋게 만들었다, 재기발랄 사춘기 예찬 코미디.",시트콤 TV 프로그램 코미디 미국 TV 프로그램,선정적 위트 엉뚱 기발
데이브레이크,"세상은 끝장났지만, 인생은 이보다 좋을 수가 없다. 종말이라 즐거운 10대 소년 조시. 괴물로 변한 어른들과 난폭한 10대 패거리들을 헤집으며, 한 소녀를 찾아 헤맨다.",TV 프로그램 만화 원작 TV 프로그램 10대 TV 프로그램 코미디 TV 프로그램 호러 미국 TV 프로그램 TV 프로그램 액션   어드벤처,색다른 이야기 흥미진진
별나라 동물들,지구에 이런 애들이 살고 있다고? 대자연이 봐도 참 특별한 생명체들. 그들보다 더 웃기는 대자연이 범상치 않은 내레이션을 선보인다. 별나고 독특한 자연 다큐멘터리.,과학   자연 다큐멘터리 다큐멘터리 자연   생태 가족이 함께 보기 좋은 TV 과학   자연 TV 프로그램 TV 프로그램 코미디 미국 TV 프로그램 다큐시리즈,푼수 캐릭터
패러다이스의 경찰들,"패러다이스 경찰서의 열혈 신참 케빈. 동료들은 나사가 빠졌고, 서장은 어딘가 모자란데, 심지어 이 서장이 케빈 아빠? 오합지졸이지만 어쩌겠어, 지금부터 임무 시작이다!",TV 프로그램 코미디 미국 TV 프로그램,황당한 이야기 선정적 폭력
하산 미나즈 쇼: 이런 앵글,"매주, 예리한 통찰과 감각으로 세상사를 꿰뚫는 쇼가 배달된다. 국제 정세, 정치, 문화, 그 무엇이든 물어보시길. 코미디언 하산 미나즈가 책임지고 해부해 줄 테니!",TV 프로그램 버라이어티   토크쇼 토크쇼 TV 프로그램 정치 TV 프로그램 코미디 미국 TV 프로그램 버라이어티 예능 리얼리티  버라이어티   토크쇼,냉소적 위트
인간이란: 저스틴 윌먼 매직쇼,"저스틴 윌먼을 만나면 상상조차 못 했던 일이 벌어진다! 사랑과 죄책감을 이용하는 실험부터, 기술과 초능력을 이해하는 체험까지. 사람의 마음을 꿰뚫어 보는 매직쇼.",리얼리티 TV TV 프로그램 코미디 미국 TV 프로그램 버라이어티 예능 리얼리티  버라이어티   토크쇼,기분 좋아지는 시간 푼수 캐릭터
언브레이커블 키미슈미트: 키미 대 교주,"중요한 이때, 어딜 간다고? 왕자와의 결혼을 앞둔 키미. 그 전에 교주의 사악한 음모를 막아야 한다. 《언브레이커블 키미슈미트》의 인터랙티브 스페셜. 자, 선택하세요!",시트콤 미국 영화 TV 프로그램 코미디 미국 TV 프로그램 코미디 다크 코미디,위트 엉뚱 기발 푼수 캐릭터
투카 앤 버티,"기쁨도, 슬픔도, 무엇이든 함께. 자유분방한 큰부리새 투카와 소심한 노래새 버티. 특별한 두 친구의 일상으로 들어간다. 여자들의 우정이 빛나는 애니메이션 코미디.",TV 프로그램 코미디 미국 TV 프로그램,황당한 이야기 선정적 엉뚱 기발
마스터 오브 제로,배우로 뜨고 싶어 애쓰는 데브. 그 와중에 데이트 기술도 업그레이드해야 한다. 둘 다 잡으려면 괴짜 친구들의 도움이 필수! 에미상과 골든글로브상을 모두 휩쓴 시리즈다.,시트콤 TV 프로그램 코미디 미국 TV 프로그램,위트 엉뚱 기발
그레이트 뉴스,"야심만만한 TV 뉴스 프로듀서 케이티. 성공을 향해 앞만 보고 달려도 모자랄 판에, 엄마가 우리 회사 인턴으로 들어오다니. 이 뜨거운 피는 엄마에게 물려받은 건가요!",시트콤 TV 프로그램 코미디 미국 TV 프로그램,위트 엉뚱 기발 푼수 캐릭터
위기의 친구들,40대를 앞둔 하버드 동기들의 우여곡절 라이프를 다룬 코미디 시리즈. 인기 시트콤 《내가 그녀를 만났을 때》의 사랑스러운 그녀 코비 스멀더스가 주연을 맡았다.,TV 프로그램 코미디 로맨스 TV 프로그램 코미디 미국 TV 프로그램,위트 로맨스
걸보스,"스펙이라고는 아무것도 없던 소피아, 얼떨결에 도전한 인터넷 쇼핑 사업에서 대박을 터뜨리면서 당당한 보스로 성장한다. 베스트셀러를 바탕으로 만들어진 코미디 시리즈.",도서 원작의 TV 프로그램 TV 프로그램 코미디 미국 TV 프로그램,엉뚱 기발 은밀한
스페셜,"뇌성마비에 게이라니, 이 청춘 참 쉽지 않다. 하지만 언제까지 새장 안에서만 살 건가! 마침내 바깥세상을 기웃거리는 라이언. 저 문 너머, 그가 꿈꾸던 삶이 있을까?",도서 원작의 TV 프로그램 TV 프로그램 코미디 미국 TV 프로그램,위트 가슴 뭉클
말런,"철딱서니 없지만, 가족이라면 깜빡 죽는 말런. 그에게 이혼이란 좀 더 특별한 가족이 된 것일 뿐. 야무진 아내와 두 아이를 향한 사랑은 오늘도 변함없이 불타오른다.",시트콤 가족이 함께 보기 좋은 TV TV 프로그램 코미디 미국 TV 프로그램,기분 좋아지는 시간 가슴 뭉클 푼수 캐릭터
이글레시아스 선생의 즐거운 교실,"이렇게 웃기는 선생님은 없었다! 모교로 돌아간 교사 가브리엘 이글레시아스. 그가 역사와 함께 인생을 가르치고, 웃음을 선사하며 변화의 바람을 일으킨다.",시트콤 TV 프로그램 10대 TV 프로그램 코미디 미국 TV 프로그램,기분 좋아지는 시간 푼수 캐릭터
대관절 해피니스,"대마에 생을 바친 운동가 루스 펠드먼. 이 좋은 걸 나만 할 수 있나! 의료용 대마초 조제소를 열고 뭇사람을 행복의 나라로 이끈다. 그대, 모든 짐을 내려놓고, 방방 떠라!",시트콤 TV 프로그램 코미디 미국 TV 프로그램,푼수 캐릭터
리얼 공포체험,오싹하면서도 유쾌한 몰래카메라가 펼쳐진다. 가족과 친구를 위해 짓궂은 장난을 준비한 사람들. 으스스한 분장과 특수 효과까지 동원하니 속지 않을 재간이 있나. 당하는 사람이 더 크게 놀랄수록 보는 기쁨이 더 커지는 짜릿한 현장 속으로.,리얼리티 TV TV 프로그램 코미디 TV 프로그램 호러 미국 TV 프로그램 버라이어티 예능 리얼리티  버라이어티   토크쇼,아드레날린 폭발 긴장감 넘치는 흥미진진
마블 데어데블,"어린 시절 사고로 시력을 잃었지만, 다른 감각이 초인적으로 발달한 맷 머독. 낮에는 변호사, 밤에는 슈퍼 히어로가 되어 쉼 없이 싸운다. 뉴욕의 헬스키친을 지키기 위해!",TV 프로그램 만화 원작 미국 TV 프로그램 TV 프로그램 액션   어드벤처,다크 흥미진진
카 마스터: 튜닝의 신,미국 캘리포니아주 터메큘라의 고담 카센터. 이곳에 튜닝의 신들이 모여 산다. 흔한 자동차 개조 거래 전문가들이 아니다. 공상을 현실로 빚어내는 환상의 마법사!,리얼리티 TV 미국 TV 프로그램 버라이어티 예능 리얼리티  버라이어티   토크쇼,흥미진진
"필이 좋은 여행, 한입만!","《내 사랑 레이몬드》의 제작자 필 로즌솔이 맛있는 여행을 떠난다. 멕시코와 베트남, 태국 등에서 맛보는 최고의 현지 음식. 배고파서 행복하다, 더 먹을 수 있으니까!",다큐멘터리 여행   어드벤처 사회   문화 다큐멘터리 TV 프로그램 음식   여행 라이프스타일 리얼리티 TV 미국 TV 프로그램 다큐시리즈 버라이어티 예능 리얼리티  버라이어티   토크쇼,위트 기분 좋아지는 시간
도전! 용암 위를 건너라,"방마다 용암이 가득하니, 어떻게 출구에 도달할까. 의자 사이를 건너뛰고 커튼에 매달리며 온몸을 던지는 도전자들. 절대 주저하지 마라. 추락하는 순간, 상금은 사라진다.",리얼리티 TV 컴퍼티션 가족이 함께 보기 좋은 TV 리얼리티 TV 미국 TV 프로그램 버라이어티 예능 리얼리티  버라이어티   토크쇼,흥미진진
익스플레인: 세계를 해설하다,"빠르게 변해가는 세상, 알아야 할 게 많기도 하다. 암호화폐부터 다이어트, 심지어 케이팝까지! 뉴스 해설 전문 Vox 미디어가 정보의 홍수에서 엄선한 필수 지식을 넓고 깊고 정확하게 짚어주는 시리즈.",과학   자연 다큐멘터리 사회   문화 다큐멘터리 과학   자연 TV 프로그램 미국 TV 프로그램 다큐시리즈,수사
작은 존재들,"광활한 미국, 지금껏 보지 못한 세계가 모습을 드러낸다. 저마다의 전략으로 삶을 영위하는 작은 동물들. 그 위대하고 극적인 생존기를 담아낸 자연 다큐멘터리 시리즈.",다큐멘터리 여행   어드벤처 과학   자연 다큐멘터리 다큐멘터리 자연   생태 가족이 함께 보기 좋은 TV 과학   자연 TV 프로그램 미국 TV 프로그램 TV 프로그램 액션   어드벤처 다큐시리즈,수사
슈거 러시: 달콤한 레이스,"달콤한 디저트 3종에 도전하라. 가장 중요한 재료는 시간. 이 레이스에서 살아남으려면 스피드는 필수, 망설임은 금물. 시간을 절약하는 것이 우승으로 가는 지름길이다.",TV 프로그램 음식   여행 리얼리티 TV 컴퍼티션 가족이 함께 보기 좋은 TV 리얼리티 TV 미국 TV 프로그램 버라이어티 예능 리얼리티  버라이어티   토크쇼,감동 흥미진진
인사이드 빌 게이츠,"누구나 궁금한 빌 게이츠의 머릿속. 이 억만장자는 어떤 생각을 하며, 어떤 생각을 품고 살아갈까. 그에게 영감을 준 사람들, 그가 추구하는 대담한 목표를 만나본다.",과학   자연 다큐멘터리 다큐멘터리 자연   생태 다큐멘터리 실존 인물 과학   자연 TV 프로그램 미국 TV 프로그램 다큐시리즈,수사
길 위의 셰프들: 아시아,"수많은 사람이 오가는 거리엔 수많은 맛이 살아있다. 끓이고 튀기고 굽고 지지고, 가끔은 날것 그대로 내는 길거리 음식. 그 맛을 따라 다양한 역사와 문화를 탐험한다.",사회   문화 다큐멘터리 TV 프로그램 음식   여행 미국 TV 프로그램 다큐시리즈,은밀한
오스만 제국의 꿈,"그 성벽은 결코 무너지지 않는다. 숱한 공격을 견딘 도시 콘스탄티노플. 오스만 제국의 술탄 메흐메트 2세가 그곳을 향해 진군한다. 역사를 바꾸고, 세상을 지배하기 위해.",다큐멘터리 밀리터리 다큐멘터리 역사 미국 TV 프로그램 다큐시리즈,풍부한 감정
캐슬바니아,드라큘라에게 포위된 도시. 그가 조종하는 괴수 군단의 공격으로부터 도시를 구하기 위해 한 남자가 전투를 시작한다. 클래식 비디오 게임에서 영감을 받은 시리즈.,일본 애니메이션 호러 비디오 게임 원작 아니메 일본 애니메이션 액션 TV 프로그램 호러 애니 시리즈 미국 TV 프로그램,폭력 무서운 이야기 다크
루폴의 드래그 레이스,독보적인 무대 장악력을 뽐내는 퀸들이 무한 경쟁에 나섰다. 이들의 목표는 10만 달러 상금과 '미국의 차세대 드래그 슈퍼스타'라는 명예. 드래그 퀸의 대모 격인 루폴이 이들의 화려한 무대를 이끈다. 에미상 수상에 빛나는 리얼리티 쇼.,리얼리티 TV 컴퍼티션 리얼리티 TV 미국 TV 프로그램 버라이어티 예능 리얼리티  버라이어티   토크쇼,현실 붕괴 은밀한
연애 실험: 블라인드 러브,"오직 마음의 끌림으로 인생의 짝을 찾아라! 대화로 사랑에 빠지고, 결혼을 약속한 후에야 얼굴을 마주하는 대담한 연애 실험. 버네사 러셰이와 닉 러셰이가 진행을 맡았다.",결혼식   로맨스  리얼리티  TV 리얼리티 TV 컴퍼티션 리얼리티 TV 미국 TV 프로그램 버라이어티 예능 리얼리티  버라이어티   토크쇼,가슴 뭉클 풍부한 감정 로맨스
파티셰를 잡아라!,"과거는 잊어주세요. 엉망진창 경력을 뒤로하고, 아마추어 제빵사들이 도전을 시작한다. 임무는 ‘걸작’을 구워라, 상금은 1만 달러! 근데 이 난장판, 리얼리티 쇼가 맞나?",TV 프로그램 음식   여행 리얼리티 TV 컴퍼티션 가족이 함께 보기 좋은 TV 리얼리티 TV 미국 TV 프로그램 버라이어티 예능 리얼리티  버라이어티   토크쇼,엉뚱 기발
타이거 킹: 무법지대,"사자와 호랑이, 온갖 별종들에 둘러싸인 남자. 타이거 킹이라 불린 희대의 말썽꾼을 중심으로, 걷잡을 수 없는 파국이 시작된다. 맹수 사육의 세계에서 일어난 충격 실화.",실제 범죄 다큐멘터리 미국 TV 프로그램 다큐시리즈,도발 수사
4차원 가족 카다시안 따라잡기,"킴, 코트니, 클로이 카다시안 자매와 이들의 어머니 크리스. '유명한 것으로 유명한' 가족이자 늘 화제와 논란을 몰고 다니는 카다시안 패밀리의 24시간을 따라간다. 이 핫한 셀럽 가족에게 지금의 명성을 가져다준 리얼리티 시리즈.",리얼리티 TV 미국 TV 프로그램 버라이어티 예능 리얼리티  버라이어티   토크쇼,스캔들 푼수 캐릭터
베벌리힐스의 진짜 주부들,"상위 1% '사모님'들의 일상, 볼 만큼 봤다고? 여기 완전히 급이 다른 여성들이 있다. 리얼리티 쇼로 극강 부촌 베벌리힐스의 삶을 속 시원히 보여준다는데. 부부 문제, 친구 문제, 자식 문제까지 다 끄집어내니, 안 볼 수가 없네!",리얼리티 TV 미국 TV 프로그램 버라이어티 예능 리얼리티  버라이어티   토크쇼,위트 기분 좋아지는 시간
슬래셔,"돌아온 연쇄 살인범, 그리고 다시 시작된 선혈 낭자한 도륙의 시간. 과거와 현재가 뒤얽힌 두려움 속에 다음 희생자는 몸서리를 친다. 서로 다른 이야기에 담긴 공포의 전율.",TV 프로그램 미스터리 TV 프로그램 호러 미국 TV 프로그램,무서운 이야기 긴장감 넘치는
